record_id,collection,subseries,episode_number,title,participants,duration,source_url,dossier_path,status
fbc-001-damian-x-fulton,Fireside BMX Chat,,1,Fireside BMX Chat - Episode 1: Damian X. Fulton,Kyle A. Huffman; Damian X. Fulton; Anne-Marie Huffman,34:18,https://www.youtube.com/watch?v=vtVr6GBJtlM,collections/fireside-bmx-chat/records/fbc-001-damian-x-fulton,dossier-compiled; transcript-verification-pending
fbc-greg-hill-floored,Fireside BMX Chat,,,Fireside BMX Chat: Greg Hill - Floored,Kyle A. Huffman; Greg Hill; Anne-Marie Huffman,16:54,https://www.youtube.com/watch?v=EI_tBe4Gf-A,collections/fireside-bmx-chat/records/fbc-greg-hill-floored,dossier-compiled; transcript-verification-pending
fbc-004-greg-mathias-chasing-harry-hof,Fireside BMX Chat,Chasing Harry,4,Chasing Harry - Episode 4: Greg Mathias at the National BMX Hall of Fame,Kyle A. Huffman; Greg Mathias; Anne-Marie Huffman,29:48,https://www.youtube.com/watch?v=EUTzVetaoLc,collections/fireside-bmx-chat/records/fbc-004-greg-mathias-chasing-harry-hof,dossier-compiled; transcript-verification-pending
fbc-linda-leary-taylor-walk-talk,Fireside BMX Chat,,,A Walk & Talk with Linda Leary Taylor,Kyle A. Huffman; Linda Leary Taylor; Anne-Marie Huffman,1:13:28,https://www.youtube.com/watch?v=2EWCctB6bss,collections/fireside-bmx-chat/records/fbc-linda-leary-taylor-walk-talk,dossier-compiled; transcript-verification-pending
fbc-005-the-boy-leary-ladies,Fireside BMX Chat,,5,The Boy: Harry Leary as Remembered by His Mother and Sisters,Kyle A. Huffman; Beverly Leary; Linda Leary Taylor; Cammie Leary,21:21,https://www.youtube.com/watch?v=92rxPCGK6Pg,collections/fireside-bmx-chat/records/fbc-005-the-boy-leary-ladies,dossier-compiled; transcript-verification-pending
fbc-jessica-reveal-archery-lesson,Fireside BMX Chat,,,Fireside BMX Chat and Archery Lesson with Jessica Reveal,Kyle A. Huffman; Jessica Reveal; Anne-Marie Huffman,55:16,https://www.youtube.com/watch?v=Gyuvtnze9N8,collections/fireside-bmx-chat/records/fbc-jessica-reveal-archery-lesson,dossier-compiled; transcript-verification-pending
fbc-lost-linda-leary-taylor-dirtwerx,Fireside BMX Chat,,,Lost Fireside BMX Chat: Linda Leary Taylor and the DIRTWERX Era,Kyle A. Huffman; Linda Leary Taylor,30:28,https://www.youtube.com/watch?v=pdP6kqSLUUs,collections/fireside-bmx-chat/records/fbc-lost-linda-leary-taylor-dirtwerx,dossier-compiled; transcript-verification-pending
