source_id,source_type,original_reference,repository_path,access,status,sha256,notes
SRC-001,YouTube upload-state screenshot,2026-07-21_17-53-22.png,source/publication/2026-07-21_17-53-22.png,public,preserved unchanged,2d15246440e6ed33df2bbfebee96072d28824fee7a8ee75034c68ec03549be5c,"Shows unlisted upload, temporary working title, channel, date, and direct video URL."
SRC-002,recording URL reference,https://www.youtube.com/watch?v=sMhoaIE3TKY,source/youtube-record.md,public reference,direct URL captured,,Audiovisual file is not copied into this repository.
SRC-003,final title and published-description snapshot,user-supplied title and description,source/published-description.md,public,preserved as supplied,,Includes the uniform Lititz BMX description block unchanged.
SRC-004,original machine transcript,Pasted text(26).txt,source/original-machine-transcript-untimed.txt,public,preserved unchanged,2967cee99ca4024048cd46931a5d59ebd2f068413686d1bd4e85e7784cac4645,Untimed YouTube subtitle text; no supplied speaker labels.
DER-001,dossier title-card access image,crop from supplied YouTube screenshot,assets/title-card.png,public derivative,exact crop plus black 16:9 letterboxing,0f4fb4818e414b77e7f2719b23629ee8904f000212ac00b2428b7229d47144f0,"No new text, glow, recoloring, or artwork added."
DER-002,navigation thumbnail,copy of title-card access image,assets/navigation-thumbnail.png,public derivative,copy,0f4fb4818e414b77e7f2719b23629ee8904f000212ac00b2428b7229d47144f0,Used by Pump Track Chat visual index.
DER-003,corrected machine transcript,Pasted text(26).txt,transcript/corrected-machine-transcript.md,public derivative,high-confidence corrections; audio verification pending,a34ef301c2a9e019777ddaff16430c1577213e191d34f7c0f4480db2246f99cc,Does not replace the unchanged source transcript.
